s	slabel	user_slabel	o	olabel	user_olabel
UBERON:0001284	renal column	renal column	UBERON:0000362	renal medulla	renal medulla
CL:0000653	glomerular visceral epithelial cell	Podocyte	UBERON:0006852	glomerular visceral epithelium	visceral epithelial layer
UBERON:0005096	descending thin limb	descending thin limb of loop of Henle	UBERON:0001289	descending limb of loop of Henle	Loop of Henle (Thin Limb)
UBERON:0001232	collecting duct of renal tubule	Tubules	UBERON:0004100	renal collecting system	renal collecting system
UBERON:0001986	endothelium	Endothelium (non glomerular)	UBERON:0006544	kidney vasculature	Vessels
UBERON:0005272	peritubular capillary	Peritubular Capillary	UBERON:0012441	endothelium of peritubular capillary	Endothelium/cortex (non glomerular)
CL:0002138	endothelial cell of lymphatic vessel	Lymphatic Endothelial Cell	UBERON:0002042	lymphatic vessel endothelium	lymphatics
